"The address already exists in the database.","Podany adres już istnieje w bazie."
"Sorry, the newsletter has not yet been configured. Please try again later.","Niestety newsletter nie został jeszcze skonfigurowany. Prosimy spróbować później."
"Newsletter Agreements","Newsletter"
"Please make sure to configure your <a href='https://app.synerise.com/setting/newsletter' target='_blank'>newsletter settings</a>.","Pamiętaj o uzupełnieniu <a href='https://app.synerise.com/setting/newsletter' target='_blank'>konfiguracji newslettera</a>."
"<u>Notice</u>: Newsletter module extends Mage_Newsletter_Model_Subscriber model.","<u>Uwaga</u>: Moduł Newsletter rozszerza model Mage_Newsletter_Model_Subscriber."
"All emails, including confirmation are handled externally via Synerise.","Wysyłka maili, łącznie z potwierdzeniem zapisu, obsługiwana jest przez system Synerise."
"Require confirmation from registered users","Wymagaj potwierdzenia od zarejestrowanych użytkowników"
"Confirmation email will be sent.","Klient otrzyma mail z prośbą o potwierdzenie subskrypcji."
"Use Ajax to submit newslleter subscriptions. <br><u>Notice</u>: Requires jQuery.","Ajaxowa wysyłka formularza zapisu do newslettera. <br><u>Uwaga</u>: wymaga jQuery."